--
-- This test creates a simple table and performs some INSERT/UPDATE/DELETE statements on it.
-- After each of those statements it checks the contents of the config and the config_log tables
--
-- we'll do all of this in a transaction to have somewhat predictable now() values
-- whenever we UPDATE values, we'll first move _log_start and _log_end one hour in the past in the log table.
BEGIN;
CREATE EXTENSION recall;
-- create a simple key/value table
CREATE TABLE config (
	key VARCHAR(100) PRIMARY KEY,
	value TEXT NOT NULL
);
-- enable pg_recall and configure it to store data for three months
SELECT recall_enable('config', '3 months');
 recall_enable 
---------------
 
(1 row)

-- insert a few values
INSERT INTO config (key, value) VALUES ('enable_something', 'true');
INSERT INTO config (key, value) VALUES ('some_number', '42');
-- check the data; log table:
--  - there has to be exactly one entry for each data table entry
--  - _start is '@ 0' in both cases
--  - _end is null
SELECT key, value FROM config ORDER BY key;
       key        | value 
------------------+-------
 enable_something | true
 some_number      | 42
(2 rows)

SELECT key, value, now() - _log_start AS _start, now() - _log_end AS _end FROM config_log ORDER BY _log_start, key;
       key        | value | _start | _end 
------------------+-------+--------+------
 enable_something | true  | @ 0    | 
 some_number      | 42    | @ 0    | 
(2 rows)

-- update value (to work around the now() issue manually set the log values back one hour)
UPDATE config_log SET _log_start = _log_start - interval '1 hour', _log_end = _log_end - interval '1 hour';
UPDATE config SET value = 'false' WHERE key = 'enable_something';
-- check data and log tables. The log table...
--  - now has three entries (two for the 'enable_something' key)
--  - start is '@ 0' for the new log entry and '1 hour' for the others
--  - end is '@ 0' for the old 'enable_something' value and NULL for all the others
SELECT key, value FROM config ORDER BY key;
       key        | value 
------------------+-------
 enable_something | false
 some_number      | 42
(2 rows)

SELECT key, value, now() - _log_start AS _start, now() - _log_end AS _end FROM config_log ORDER BY _log_start, key;
       key        | value |  _start  | _end 
------------------+-------+----------+------
 enable_something | true  | @ 1 hour | @ 0
 some_number      | 42    | @ 1 hour | 
 enable_something | false | @ 0      | 
(3 rows)

-- do a bulk key update (the equivalent to deleting all entries and creating new ones)
UPDATE config_log SET _log_start = _log_start - interval '1 hour', _log_end = _log_end - interval '1 hour';
UPDATE config SET key = key||'_';
SELECT key, value FROM config ORDER BY key;
        key        | value 
-------------------+-------
 enable_something_ | false
 some_number_      | 42
(2 rows)

SELECT key, value, now() - _log_start AS _start, now() - _log_end AS _end FROM config_log ORDER BY _log_start, key;
        key        | value |  _start   |   _end   
-------------------+-------+-----------+----------
 enable_something  | true  | @ 2 hours | @ 1 hour
 some_number       | 42    | @ 2 hours | @ 0
 enable_something  | false | @ 1 hour  | @ 0
 enable_something_ | false | @ 0       | 
 some_number_      | 42    | @ 0       | 
(5 rows)

-- delete an entry (again after pushing log entries back one hour)
UPDATE config_log SET _log_start = _log_start - interval '1 hour', _log_end = _log_end - interval '1 hour';
DELETE FROM config WHERE key = 'some_number_';
SELECT key, value FROM config ORDER BY key;
        key        | value 
-------------------+-------
 enable_something_ | false
(1 row)

SELECT key, value, now() - _log_start AS _start, now() - _log_end AS _end FROM config_log ORDER BY _log_start, key;
        key        | value |  _start   |   _end    
-------------------+-------+-----------+-----------
 enable_something  | true  | @ 3 hours | @ 2 hours
 some_number       | 42    | @ 3 hours | @ 1 hour
 enable_something  | false | @ 2 hours | @ 1 hour
 enable_something_ | false | @ 1 hour  | 
 some_number_      | 42    | @ 1 hour  | @ 0
(5 rows)

-- query the log table for the current state (for an easy way to compare it to the data table)
SELECT key, value FROM config_log WHERE _log_start <= now() AND (_log_end IS NULL OR _log_end > now()) ORDER BY key;
        key        | value 
-------------------+-------
 enable_something_ | false
(1 row)

SELECT key, value FROM config ORDER BY key;
        key        | value 
-------------------+-------
 enable_something_ | false
(1 row)

-- query the log table for the state of one hour ago:
SELECT key, value FROM config_log WHERE _log_start <= now() - interval '1 hour' AND (_log_end IS NULL OR _log_end > now() - interval '1 hour') ORDER BY key;
        key        | value 
-------------------+-------
 enable_something_ | false
 some_number_      | 42
(2 rows)

-- query the log table for the state of one hour and one minute ago:
SELECT key, value FROM config_log WHERE _log_start <= now() - interval '61 minutes' AND (_log_end IS NULL OR _log_end > now() - interval '61 minutes') ORDER BY key;
       key        | value 
------------------+-------
 enable_something | false
 some_number      | 42
(2 rows)

-- list all the changes to the 'enable_something' record
SELECT key, value, now() - _log_start AS _start, now() - _log_end AS _end FROM config_log WHERE key = 'enable_something' ORDER BY _log_start, key;
       key        | value |  _start   |   _end    
------------------+-------+-----------+-----------
 enable_something | true  | @ 3 hours | @ 2 hours
 enable_something | false | @ 2 hours | @ 1 hour
(2 rows)

ROLLBACK;
